[
  {
    "name": "South Sudan",
    "iso3": "SSD",
    "mentionType": "rights-risk precedent",
    "summary": "South Sudan shows how poorly designed cybercrime or online-safety legislation can be weaponised against rights and civic space. Criticism of the Cybercrimes Act 2026 focuses on vague definitions of false information and undesirable content.",
    "articleRefs": [
      "5. Structural Gaps, paragraph 39",
      "6.2 Barriers, paragraphs 53-54",
      "7.1 Civil Society Organisations, paragraph 64"
    ]
  }
]
